{
  "$schema": "http://json-schema.org/draft-07/schema#",
  "title": "HowlFrame Benchmark v2 Result",
  "type": "object",
  "properties": {
    "task": {
      "type": "string",
      "description": "The name of the benchmark task (e.g., task_01_typed_function)"
    },
    "language": {
      "type": "string",
      "description": "The programming language being benchmarked (e.g., howlframe, go, python, node)"
    },
    "track": {
      "type": "string",
      "enum": ["A", "B"],
      "description": "Track A (Language generation) or Track B (Agentic development)"
    },
    "model": {
      "type": "string",
      "description": "The AI model used for generation (e.g., gemini-1.5-pro, gpt-4o)"
    },
    "metrics": {
      "type": "object",
      "properties": {
        "first_pass_success": {
          "type": "boolean",
          "description": "Did the very first generated code pass all tests?"
        },
        "eventual_success": {
          "type": "boolean",
          "description": "Did it eventually pass all tests after repairs?"
        },
        "repair_attempts": {
          "type": "integer",
          "description": "Number of repair attempts (0 if first pass succeeded)"
        },
        "total_generated_tokens": {
          "type": ["integer", "null"],
          "description": "Total output tokens generated by the model across all attempts. Null if unavailable."
        },
        "final_source_tokens": {
          "type": "integer",
          "description": "Token count of the final correct source code using cl100k_base or similar standard."
        },
        "elapsed_time_seconds": {
          "type": "number",
          "description": "Wall-clock time from start of prompt to verified artifact, in seconds."
        },
        "verification_commands_run": {
          "type": "integer",
          "description": "Total number of build/test/verification commands executed during the process."
        },
        "code_churn_lines": {
          "type": ["integer", "null"],
          "description": "Total lines added/removed during repair phases. Null if not tracked."
        },
        "verification_result": {
          "type": "string",
          "enum": ["pass", "fail", "error"],
          "description": "Final verification status."
        },
        "runtime_backend": {
          "type": "string",
          "description": "The runtime or backend used (e.g., HowlFrame VM, Go 1.22, Node 20)."
        },
        "capability_denial_behavior": {
          "type": ["string", "null"],
          "description": "Description of how the code handled restricted capabilities, if applicable to the task."
        },
        "deterministic_repeatability": {
          "type": ["string", "null"],
          "description": "Result of deterministic repeatability check (e.g., identical outputs on 5 runs), if applicable."
        }
      },
      "required": [
        "first_pass_success",
        "eventual_success",
        "repair_attempts",
        "final_source_tokens",
        "elapsed_time_seconds",
        "verification_commands_run",
        "verification_result",
        "runtime_backend"
      ]
    },
    "timestamp": {
      "type": "string",
      "format": "date-time"
    },
    "notes": {
      "type": "string",
      "description": "Any manual notes, anomalies, or limitations observed during this run."
    }
  },
  "required": ["task", "language", "track", "model", "metrics", "timestamp"]
}
