{
  "task": "task_01_typed_function",
  "language": "howlframe",
  "track": "A",
  "model": "reference",
  "timestamp": "2026-10-10T17:30:10.244544+00:00",
  "notes": "Tokens counted using tiktoken(cl100k_base)",
  "metrics": {
    "first_pass_success": true,
    "eventual_success": true,
    "repair_attempts": 0,
    "total_generated_tokens": null,
    "final_source_tokens": 54,
    "elapsed_time_seconds": 0.01,
    "verification_commands_run": 2,
    "code_churn_lines": null,
    "verification_result": "pass",
    "runtime_backend": "HowlFrame VM",
    "capability_denial_behavior": null,
    "deterministic_repeatability": null
  }
}